"","id","name","genres","group","n_edges","bio","top_track_id","top_track_name","top_track_preview_url","image"
"74","6Ha4aES39QiVjR0L2lwuwq","Yo Gotti","crunk, dirty south rap, gangster rap, memphis hip hop, pop rap, rap, southern hip hop, trap music","related",7,"Mario Mims (born May 19, 1981 in Memphis, Tennessee), better known by his stage name Yo Gotti, is an American rapper signed to Cash Money Records. Formerly known as Lil Yo in the 90's, he released his first album, From Da Dope Game 2 Da Rap Game, in 2000. Since then he has released 2001's Self-Explanatory, 2003's Life, 2006's Back 2 Da Basics, 2008's Cocaine Muzik, 2009's CM2 (Cocaine Muzik 2 hosted by DJ Drama), and The Pyrex King: Street Runnaz Special Edition. <a href=""https://www.last.fm/music/Yo+Gotti"">Read more on Last.fm</a>","2nBI3iWLhupR7LyAJ5GGkE","Champions","https://p.scdn.co/mp3-preview/74d73f6f9ceeddac4dd88250dd5382b0a746b635","https://i.scdn.co/image/e9949b4cfb8d481a5d5459bb559d09b8abe464cb"
"75","5oNgAs7j5XcBMzWv3HAnHG","DJ Drama","crunk, dirty south rap, gangster rap, hip hop, pop rap, rap, southern hip hop, trap music","related",3,"DJ Drama (born Tyree Cinque Simmons on April 22, 1978 in Philadelphia) is the DJ wtih wide experience in the mixtape game, perhaps best known for the ""Gangsta Grillz"" series.  He has worked with a wide range of acts including T.I., Jime Jones, Saigon, Lil Wayne, Young Jeezy, Webbie, Little Brother, and the Pimp Squad Click (P$C). He's also one third of the highly productive Aphilliates Music Group with DJ Don Cannon and DJ Sense. On January 16, 2007 <a href=""https://www.last.fm/music/DJ+Drama"">Read more on Last.fm</a>","4vNeJ6DoAlTPzoYO9W4mJH","Wishing (feat. Chris Brown, Skeme & Lyquin)","https://p.scdn.co/mp3-preview/81596d0817488cf6d8a9a6ca41365f0f98f305db","https://i.scdn.co/image/463c030740f41e0bbd879b6daf791bc8b2ab9e01"
"76","5LHRHt1k9lMyONurDHEdrp","Tyga","hip hop, pop rap, rap, southern hip hop, trap music","related",5,"Michael Stevenson (born November 19, 1989 in Compton, California), better known by his stage name Tyga, is an American hip hop artist signed to Lil Wayne's Young Money Entertainment and Decaydance. He is the cousin of Travis McCoy, lead vocalist of the group Gym Class Heroes. In 2006 he released his first mixtape, Young on Probation, and released his debut studio album, No Introduction, in 2008. He has since released a further mixtapes, with the latest being Well Done 3, released in the summer of 2012.. <a href=""https://www.last.fm/music/Tyga"">Read more on Last.fm</a>","0k6DnZMLoEUH8NGD5zh2SE","Ayo","https://p.scdn.co/mp3-preview/cf4f1af69fe88c57d54e2d9a6f2ef74ea05d731b","https://i.scdn.co/image/e498616a66432d1b411c48125dc2a45489350e5d"
"77","0QHgL1lAIqAw0HtD7YldmP","DJ Khaled","crunk, dirty south rap, gangster rap, hip hop, pop rap, rap, southern hip hop, trap music","related",5,"Khaled Khaled (born November 26, 1975 in New Orleans, Louisiana), better known by his stage name DJ Khaled, is a Palestinian-American DJ, producer, President of Def Jam South and radio personality for the Miami-based urban music radio station WEDR. He is also the official DJ of the hip hop group Terror Squad. In 2006 he released his debut solo album, Listennn... The Album, and has since relased 2007's We The Best, 2008's We Global  2010's Victory and 2011's We The Best Forever. <a href=""https://www.last.fm/music/DJ+Khaled"">Read more on Last.fm</a>","5TqBAOIBe0bQA0spNdcG3k","For Free","https://p.scdn.co/mp3-preview/930ea9b04f9f1507793dae757dd1c0b17eface05","https://i.scdn.co/image/8d2118ab9ae51fc00fd63634141f6165bf5fc541"
"78","6f4XkbvYlXMH0QgVRzW0sM","Waka Flocka Flame","crunk, dirty south rap, gangster rap, hip hop, pop rap, rap, southern hip hop, trap music","related",7,"Juaquin Malphurs, (born May 31 1986) better known by his stage name Waka Flocka Flame, is an American rapper signed to So Icey Entertainment. He is the son of Debra Antney, Gucci Mane's  former manager and CEO of So Icey/Mizay Entertainment.

Malphurs moved with his family from Jamaica, Queens, New York to Riverdale, Georgia when he was nine years old. The name ""Waka"" was taken from Fozzie Bear. The name ""Flocka Flame"" was given to him by rapper Gucci Mane. <a href=""https://www.last.fm/music/Waka+Flocka+Flame"">Read more on Last.fm</a>","03tqyYWC9Um2ZqU0ZN849H","No Hands [feat. Roscoe Dash and Wale]","https://p.scdn.co/mp3-preview/ad0319a8812cdf5390982c3b0d577a11505ea797","https://i.scdn.co/image/15300b99e14dd8df4eb901a84942b2ad901f9d64"
"79","4ubKsFJjMgWkARG6w2Qlv8","Vado","deep trap, pop rap, rap, southern hip hop, trap music","related",3,"Vado is on a fast track to becoming the next rap sensation out of Harlem. Teeyon Winfree aka Vado grew up in what is known as the “Hall of Fame” area of Harlem, the same streets that spawned hip hop icons Big L, Cam’ron, Mase, Max B and Jae Millz. He is the first artist signed to the U.N., Cam’ron’s newly formed music group.

Vado’s versatile talent, unique rap skills and undeniable swag set him apart from many up and coming artists. He <a href=""https://www.last.fm/music/Vado"">Read more on Last.fm</a>","4NoNL7fjWo0SLUE9S591Is","My Bae","https://p.scdn.co/mp3-preview/27ad63efa00609ad25131587aebf7a84580d9edd","https://i.scdn.co/image/b8b5b3fffcac0db7b3dd54b1dc4b1a1cdfdc7a84"
"80","31HjiqargV4NAw4GZqUale","Ace Hood","crunk, dirty south rap, gangster rap, hip hop, pop rap, rap, southern hip hop, trap music","related",5,"Antoine McColister (born May 11, 1988 in Port St. Lucie, Florida), better known by his stage name Ace Hood, is an American rapper signed to DJ Khaled's label, We The Best Music. Following a football injury in the tenth grade he began to seriously consider rapping as a career. In 2007, he met DJ Khaled and gave him his demo tape. Khaled asked Ace to rap over the instrumental of I'm So Hood and then decided to sign him. His debut album, Gutta, was released in 2008 and featured appearances from T-Pain, Rick Ross, Akon, Flo Rida and Trey Songz. <a href=""https://www.last.fm/music/Ace+Hood"">Read more on Last.fm</a>","0uFvvXbmGIXlf5ZgtHyYpf","Bugatti","https://p.scdn.co/mp3-preview/5fa1ec647a8b2c778478f107dddedb5f513dcf87","https://i.scdn.co/image/84eee5e315740f66da0c44d54b91addf14114e91"
"81","3aGFCoR8xGN6DKwvdzeSja","ILoveMakonnen","indie r&b, pop rap, rap, southern hip hop, trap music","related",4,"iLoveMakonnen is an Atlanta-based musician, signed to Drake's OVO imprint, who pulls inspiration from various genres such as hip-hop & bedroom-pop.  
www.ilovemakonnenmusic.com

Stream more of his music on soundcloud. <a href=""https://www.last.fm/music/iLoveMakonnen"">Read more on Last.fm</a>","4PWY72AubTjoZrohQt0pWn","Tuesday (feat. Drake)","https://p.scdn.co/mp3-preview/0a1aa2a9efc2b6b20c00f35466a917b4abf4ab73","https://i.scdn.co/image/ecaa83adbd081fd4252ca4de720c61133a5cb5d9"
"82","5lHRUCqkQZCIWeX7xG4sYT","Rich Homie Quan","deep trap, gangster rap, pop rap, rap, southern hip hop, trap music","related",4,"Dequantes Lamar (born October 4, 1989), better known by his stage name Rich Homie Quan, is an American hip hop artist from Atlanta, Georgia, USA. He has released several mixtapes since 2011, including I Go In On Every Song, Still Goin In, Still Goin In (Reloaded) and I Promise I Will Never Stop Going In. <a href=""https://www.last.fm/music/Rich+Homie+Quan"">Read more on Last.fm</a>","2LLFl56eIFGFlnrplUC26f","Flex (Ooh, Ooh, Ooh)","https://p.scdn.co/mp3-preview/4ddebe22a78b379fac4991965663b007553bf282","https://i.scdn.co/image/f24a7dd40451220f0eefc91e1d4ebdc93b97b555"
"83","0nvvVQhPQGkYTJlThLbJeu","OG Maco","deep trap, rap, southern hip hop, trap music, underground hip hop","related",3,"OG Maco is a hip-hop artist from Atlanta currently signed to Atlanta based Independent  label Quality Control. <a href=""https://www.last.fm/music/OG+Maco"">Read more on Last.fm</a>","4UUFTQKwwId0n1P9t4ZQhx","U Guessed It","https://p.scdn.co/mp3-preview/dba266e3e3dbd7bacf00b4d4addfbe604e63e7b0","https://i.scdn.co/image/bb3117e772bedd38e035a2117788ce8edf52e737"
"84","0Y5tJX1MQlPlqiwlOH1tJY","Travis Scott","pop rap, rap, trap music","related",9,"Jacques Webster (born April 30, 1992), better known by his stage name Travis Scott (stylized as Travi$ Scott), is an American hip hop recording artist and record producer from Houston, Texas. He is currently signed to Epic Records and T.I.'s Grand Hustle imprint, while signed to Kanye West's Very GOOD Beats as a producer. He first became widely known for his production and verse on GOOD Music's ""Sin City"". His debut EP Owl Pharaoh, was released on May 21, 2013. <a href=""https://www.last.fm/music/+noredirect/Travis+Scott"">Read more on Last.fm</a>","20dP2DaMHIAmwWAbp7peSr","pick up the phone","https://p.scdn.co/mp3-preview/096740087670272bd8d4a1d4b2dcec26c7965e5f","https://i.scdn.co/image/270570e16abb405058f22a9d35a5f27aab0211f4"
"85","6oMuImdp5ZcFhWP0ESe6mG","Migos","pop rap, rap, southern hip hop, trap music","related",4,"Migos are a Rap trio-group from Lawrenceville, GA consisting of members: Quavo (Quavious Marshall), Offset (Kiari Cephus) and Takeoff (Kirshnik Ball)

Originally, the group started as family, who all had an interest in music, it wasn't until 2008 when this trio took their talent serious, put together and released their first project ""Juug Season"" in 2011. T​he group later released another mixtape titled ""No Label"" in 2012, which featured ""Bando"", a track that was​ soon labeled a ""dope-boy anthem.""  <a href=""https://www.last.fm/music/Migos"">Read more on Last.fm</a>","2n5gVJ9fzeX2SSWlLQuyS9","Fight Night","https://p.scdn.co/mp3-preview/2a7b91b3e760629de9e564cf701ec658c633b453","https://i.scdn.co/image/6e53f6f75f1040bca4e8b60f5f5782cc1549d756"
"86","1gPhS1zisyXr5dHTYZyiMe","Kevin Gates","deep trap, pop rap, rap, southern hip hop, trap music","related",4,"Kevin Gilyard (born February 5, 1986), better known by his stage name Kevin Gates, is an American rapper and singer from Baton Rouge, Louisiana. In 2013, it was announced that Gates signed to Young Money Entertainment.
Kevin Gates first began rapping in 2007, when he began making music with fellow Louisiana natives such as Webbie and Lil Boosie. Gates first received attention with his 2008 single ""Get in the Way"" featuring Lil Boosie. Soon after, he and Boosie would be incarcerated in separate cases. <a href=""https://www.last.fm/music/Kevin+Gates"">Read more on Last.fm</a>","0wdKiSBUT7aZkXUIdJWcwC","2 Phones","https://p.scdn.co/mp3-preview/1d3c6c844fa6f0f6fa242966da884f9b196b3d28","https://i.scdn.co/image/84ea2b38b848fbd30167d511ba2a368cddd626f1"
"87","1Zatb2YN4erBOoSivOXc0o","O.T. Genasis","pop rap, rap, southern hip hop, trap music","related",4,"Odis Flores, better know as ""O.T. Genasis"", is a rapper of Belizean descent who grew up in Long Beach, California, after his parents immigrated to the United States. He was first signed by G-Unit Records in 2011, where he released his 2012 mixtape, Black Belt. He was later dropped from the label, only to be discovered by Busta Rhymes when he performed ""Touchdown"" four times in a row. This performance led to his deal with Busta's Conglomerate label and the remix to ""Touchdown"", which featured Busta, French Montana, and Juicy J. <a href=""https://www.last.fm/music/O.T.+Genasis"">Read more on Last.fm</a>","376KnY4TrgBITxjlnbnmIy","Cut It (feat. Young Dolph)","https://p.scdn.co/mp3-preview/2eabe0da626da88e0fd714b3b1a36a7e36eaf620","https://i.scdn.co/image/ccf307e8cc1d1c4849fe7237c4d19ddf23c53736"
"88","5bgfj5zUoWpyeVatGDjn6H","K CAMP","deep trap, pop rap, rap, southern hip hop, trap music","related",3,"Kris Campbell (born April 27, 1990), better known by his stage name K Camp, is an American rapper. He hails from Atlanta, Georgia. He is best known for the singles ""Money Baby"" and ""Cut Her Off"". He signed a record deal with Interscope Records, and released his debut EP In Due Time. <a href=""https://www.last.fm/music/K+Camp"">Read more on Last.fm</a>","2BqQQXuBOuhaWeUP7okEx0","Comfortable","https://p.scdn.co/mp3-preview/96f5907c10034294fae4041a03575e108393e75d","https://i.scdn.co/image/28d7b0ee2e0a59dbe048fd0d63bb996c49214d5c"
"89","246dkjvS1zLTtiykXe5h60","Post Malone","rap, trap music","related",9,"Post Malone is a rapper and singer from Dallas. He first gained popularity after linking up with production duo FKi, creating several successful collaborations such as ""White Iverson"", ""Too Young"" and ""Tear$"".  <a href=""https://www.last.fm/music/Post+Malone"">Read more on Last.fm</a>","2N0NifjyXAdMOB4KBGvBJ6","White Iverson","https://p.scdn.co/mp3-preview/ed706ff683776bc0e7f249c3ea11defe8cc264d7","https://i.scdn.co/image/b61164ffdd64448fe6dfe0b5fc2b07b6f4a63d65"
"90","7kFfY4UjNdNyaeUgLIEbIF","Dej Loaf","detroit hip hop, rap, trap music","related",3,"Dej Loaf (stylized as DeJ Loaf), is an American rapper and singer. Born in Detroit, Michigan, she began her music career in 2011 with Ajure Harding and released her debut mixtape Just Do It the following year. In October 2014, her second mixtape, Sell Sole, came out. DeJ Loaf rose to greater popularity in 2014 with her single ""Try Me"", which initially attained viral internet popularity and has since peaked at number 46 on the Billboard Hot 100.

DeJ Loaf was born in Detroit <a href=""https://www.last.fm/music/Dej+Loaf"">Read more on Last.fm</a>","5zBqPjh3vfttJScml99szD","Back Up","https://p.scdn.co/mp3-preview/8181ac7435bd1db23317c87b8941649c29ebb026","https://i.scdn.co/image/ebb2da3d53a7d6320d77e38eaabb17cdaedef435"
"91","7c0XG5cIJTrrAgEC3ULPiq","Ty Dolla $ign","pop rap, rap, trap music","related",4,"Tyrone Griffin (born April 13, 1985), better known by his stage name Ty Dolla Sign (stylized as Ty Dolla $ign or Ty$), is an American singer, rapper and producer from Los Angeles, California. He is currently signed to Wiz Khalifa's Taylor Gang Records and Atlantic Records.

The son of a musician from Lakeside, Ty Dolla $ign originally began his career in music by learning the bass guitar. Since then, he has learned several instruments, from the drums, guitars, and keyboard to the MPC. <a href=""https://www.last.fm/music/Ty+Dolla+$ign"">Read more on Last.fm</a>","7t2bFihaDvhIrd2gn2CWJO","Or Nah (feat. The Weeknd, Wiz Khalifa and DJ Mustard) - Remix","https://p.scdn.co/mp3-preview/70f126c139847335bc03c756c55b80c99892268e","https://i.scdn.co/image/ca73ab6ed22ed12fc8136ca41b2270963177cf13"
"92","5dHt1vcEm9qb8fCyLcB3HL","A$AP Ferg","hip hop, pop rap, rap, southern hip hop, trap music","related",7,"Darold Ferguson, Jr. (born October 20, 1988), better known by his stage name ASAP Ferg (stylized as A$AP Ferg), is an American hip hop recording artist from New York City's Harlem neighborhood. He is a member of the hip hop collective A$AP Mob, from which he adopted his moniker. In January 2013, Ferg signed a solo record deal with Polo Grounds and RCA, the same labels that helped launch A$AP Worldwide, when Ferg's A$AP Mob cohorts ASAP Rocky and ASAP Yams, negotiated their own respective deal in 2011. <a href=""https://www.last.fm/music/A$AP+Ferg"">Read more on Last.fm</a>","7xVLFuuYdAvcTfcP3IG3dS","Work REMIX","https://p.scdn.co/mp3-preview/0255172e91edc745416b611a7d77966c6fc9c6eb","https://i.scdn.co/image/cc444207f4302d499b5cf05fac8b8637069c9a23"
"93","6PXS4YHDkKvl1wkIl4V8DL","Fetty Wap","pop rap, rap, trap music","related",3,"Willie Maxwell II (born June 7, 1991), better known by his stage name Fetty Wap, is an American hip hop recording artist from Paterson, New Jersey. He began taking interest in music in 2013. Initially starting off as only a rapper, he later decided to start singing as well because he ""wanted to do something different"". He was nicknamed ""Fetty"" (slang for money) as he was known for making money. ""Wap"" was added to the end of the name to perform under in tribute to Gucci Mane's alias, GuWop. <a href=""https://www.last.fm/music/Fetty+Wap"">Read more on Last.fm</a>","5NQbUaeTEOGdD6hHcre0dZ","679 (feat. Remy Boyz)","https://p.scdn.co/mp3-preview/80fad54c551fb6e366ce5523ca4028361365fcd8","https://i.scdn.co/image/c9da9c8aeee9487838cd997bbc264266ae3d8123"
"94","0bdJZl7TDeiymDYzMJnVh2","P Reign","pop rap, rap, southern hip hop, trap music","related",2," <a href=""https://www.last.fm/music/+noredirect/P+Reign"">Read more on Last.fm</a>","5EMKS6mLi4JprJxy8IGdhT","DnF","https://p.scdn.co/mp3-preview/6379b9c5bbccccf6df861624d129f9a3aa38849e","https://i.scdn.co/image/d0373d714e413602ff733b50bf3dcf3e23dada76"
"95","7Kp7SzuRuNiPFCy7JIwnLx","Ca$h Out","crunk, deep trap, gangster rap, pop rap, rap, southern hip hop, trap music","related",3,"Here is some background information on Ca$h Out from the Cashin Out Songfacts: 
Fulton County, Georgia Native John “Ca$h Out” Gibson started hustling in the streets at the age of 13 and within a few years he’d accumulated enough money to be able to pay for his own apartment. However, that home turned into a drug haven where narcotics were sold and at 18-years-old, Gibson found himself facing a variety of charges and a decade in jail if convicted. <a href=""https://www.last.fm/music/Ca$h+Out"">Read more on Last.fm</a>","1POAx4NMLOBPVKZUSsBh92","Cashin' Out","https://p.scdn.co/mp3-preview/fd02a31e9bfe913ccba49eed94067c5db3aeed2e","https://i.scdn.co/image/3dbf7b0c4ce10796a0476c339b84b3f847a09033"
"96","0T5OJgMVjKIX3b3W3ekqOl","Rocko","crunk, deep trap, dirty south rap, gangster rap, pop rap, rap, southern hip hop, trap music","related",3,"2 Different Rocko's
Rocko is a Rap Artist.
Rocko is a Pop Artist.



Rocko (born Rodney Hill, Jr.) is an American rapper from Atlanta, Georgia. Signed to So So Def/Island Urban Music through his own Rocky Road Records imprint, Rocko's first single, ""Umma Do Me"", was released in late 2007. His album, Self-Made, was released on March 18, 2008.

Outside of his music career, Rocko is the former fiance' of R&B singer Monica, with whom he has two children. <a href=""https://www.last.fm/music/Rocko"">Read more on Last.fm</a>","0HFrCOmhCYXlv4NdEwRAuj","U.O.E.N.O. (feat. Rick Ross, Future)","https://p.scdn.co/mp3-preview/22e168936fab981fc32b9cbbd09201a982090d50","https://i.scdn.co/image/44eeadbc6dad06ed97e94d983c6402a134bfac63"
"97","4TsHKU8l8Wq7n7OPVikirn","Jidenna","rap","related",2,"Jidenna Theodore Mobisson, known synonymously as Jidenna, (born April 5, 1985 in Wisconsin Rapids, Wisconsin)[1] is an American musical artist and performer. He is signed to Wondaland Records and in 2015 released two singles, ""Classic Ma is signed to Janelle Monáe's Wondaland Records label[11] and distributed through Epic Records. He has collaborated with numerous artists, including Roman GianArthur, St. Beauty, Deep Cotton and Janelle Monáe herself, recording a five-song compilation EP titled The Eephus. <a href=""https://www.last.fm/music/Jidenna"">Read more on Last.fm</a>","25gSVIBOWeUqXG8DnzpCCs","Long Live the Chief","https://p.scdn.co/mp3-preview/076ee403d9d8c4af2c8bfa305a4a605c58f34366","https://i.scdn.co/image/79a30da660150653dc4fd30f1970cfb8f1e9f918"
"98","3ZooCJzNMTLpmJaIRUEorI","Young Dro","crunk, deep trap, dirty south rap, gangster rap, hip hop, pop rap, rap, southern hip hop, trap music","related",2,"D'Juan Hart (born January 15, 1979 in Bankhead, Atlanta), better known by his stage name Young Dro, is an American rapper signed to T.I.'s Grand Hustle Records. He released his debut album, I Got That Dro, independently in 2000 under the name Dro before signing with Grand Hustle in 2005. His major label debut, Best Thang Smokin', was released in 2006, and his second album, P.O.L.O (Playas Only Live Once) will be released sometime in 2010.


Born in the notorious Bankhead Court housing project <a href=""https://www.last.fm/music/Young+Dro"">Read more on Last.fm</a>","19fKNXNkmWhuAQyGbxyFXg","FDB","https://p.scdn.co/mp3-preview/ad7ca3b1be14ee97a5c92dcd0ea8a9604c51a9aa","https://i.scdn.co/image/d1c70ecae088fdf85c4305d65b50bbbd87653ee1"
"99","3Y365ZqTf6fJ4ZcRnLKPGt","Gorilla Zoe","crunk, dirty south rap, gangster rap, hip pop, pop rap, rap, southern hip hop, trap music","related",2,"Alonzo Mathis (born November 28, 1980 in Atlanta, Georgia), better known by his stage name Gorilla Zoe, is an American rapper and a member of the Southern rap group Boyz N Da Hood. Signed to Diddy's Bad Boy Entertainment, his debut solo album, Welcome to the Zoo was released in 2007, and his second album Don't Feed Da Animals was released in March of 2009. Gorilla Zoe appears to have a feud with rapper The Game, dissing him on the track ""1 Sluggg"". <a href=""https://www.last.fm/music/Gorilla+Zoe"">Read more on Last.fm</a>","7ytLGF9Ua5g5MylbwtxzZC","Echo","https://p.scdn.co/mp3-preview/1b887bb91c8e1a7e89fd4defd802e492665605de","https://i.scdn.co/image/8db99d441dba8c0f406129796a3c28f58f92360f"
"100","4yBK75WVCQXej1p04GWqxH","Jeezy","crunk, dirty south rap, gangster rap, hip hop, hip pop, pop rap, rap, southern hip hop, trap music","related",3,"Jay Jenkins born October 12, 1977 in Columbia, South Carolina), better known by his stage name Jeezy, formerly Young Jeezy and Lil J, is an American rapper and actor signed to Def Jam Records. In 2001 he released his solo debut album Thuggin' Under the Influence, under the name Lil J, which featured production from Lil Jon. In 2004 he signed with Bad Boy Records and joined the group Boyz N Da Hood, whose self-titled album was released in June 2005. <a href=""https://www.last.fm/music/+noredirect/Jeezy"">Read more on Last.fm</a>","5dANgSy7v091dhiPnEXNrf","Put On","https://p.scdn.co/mp3-preview/3bdc43ca88b0d4b1617e84403bfde680a52a6900","https://i.scdn.co/image/16dbd75ff1dcc86d9b2309a35416e2c331ef3443"
"101","4OBJLual30L7gRl5UkeRcT","T.I.","crunk, dance pop, dirty south rap, gangster rap, hip hop, hip pop, pop rap, rap, southern hip hop, trap music","related",3,"Clifford Joseph Harris Jr. (born September 25, 1980 in Bankhead, Atlanta, Georgia), better known by his stage name T.I., and also by his alter ego T.I.P., is a Grammy award winning American rapper, producer, actor, and co-CEO of Grand Hustle Records. In 2001 he released his debut solo album, I'm Serious through Arista Records. Since then he has released 2003's Trap Muzik, 2004's Urban Legend, 2006's King, 2007's T.I. vs. T.I.P, 2008's Paper Trail, and his latest CD No Mercy released December 7, 2010. <a href=""https://www.last.fm/music/T.I."">Read more on Last.fm</a>","3tvWMBIblzT5FSjKtIeRR1","Whatever You Like","https://p.scdn.co/mp3-preview/c82678be83d118b5d815dda0ecc00b5ad99e81e3","https://i.scdn.co/image/fd4988d4da581fc3749490c71303230aa70199d6"
"102","5OrB6Jhhrl9y2PK0pSV4VP","Young Money","crunk, dirty south rap, gangster rap, hip hop, pop rap, rap, southern hip hop, trap music","related",2,"Young Money is an imprint of Cash Money Records founded by Lil Wayne in 2005. In 2009 artists on the label including Drake, Jae Millz, Mack Maine, Tyga, Gudda Gudda, T-Streets, Lemon Drop, Nicki Minaj, Lil Chuckee, Short Dawg, Shanell and Lil Twist went on a nationwide tour and decided to work on a collaboration album titled We Are Young Money. It was released December 21, 2009 and also featured guest appearances from Lloyd, Birdman, Gucci Mane and Nate Bailey. <a href=""https://www.last.fm/music/Young+Money"">Read more on Last.fm</a>","6HfOzLLjsaXsehIFEsrxTk","Trophies","https://p.scdn.co/mp3-preview/8140baded1c88864ebff1d7e3c31e9709aab3385","https://i.scdn.co/image/573c5319cd2bbe266ff9f635191a63364890f745"
"103","35sCXuy5gN6Or69rZ9vqBs","Birdman","crunk, dirty south rap, gangster rap, hip hop, hip pop, pop rap, rap, southern hip hop, trap music","related",2,"Bryan Williams (born February 15, 1969), better known by his stage name Birdman or Baby, is an American rapper and record executive from New Orleans, Louisiana. He is the co-founder of Cash Money Records and one half of the duo Big Tymers. Along with his releases with Big Tymers and for his solo career, Birdman recorded a collaboration album and numerous tracks with Lil Wayne.

Birdman was born and raised in Uptown New Orleans. With his brother Ronald ""Slim"" Williams, Birdman founded Cash Money Records in 1991. <a href=""https://www.last.fm/music/Birdman"">Read more on Last.fm</a>","3rMyMv8EjKXoPnaRo2hdJN","Stuntin' Like My Daddy - Street","https://p.scdn.co/mp3-preview/4cb79c948bf675382120398e33a8d4274638c890","https://i.scdn.co/image/8414a01f3f3ce41a5c76b5eb8ff2f1c60fc6a723"
"104","6eUSUma6IbsuvfAs9c0Kti","Young Greatness","dwn trap, trap music","related",5,"Young Greatness is an American rapper from New Orleans. He has worked with producer Jazze Pha on his song Moolah. <a href=""https://www.last.fm/music/Young+Greatness"">Read more on Last.fm</a>","5htB2gxndGHrLb09x1Q3Vp","Moolah","https://p.scdn.co/mp3-preview/8e6de462d88911bf80c6993914400cdaf278c160","https://i.scdn.co/image/89ba7403cf34cb0259e63a497c4bcaff8630e54e"
"105","699OTQXzgjhIYAHMy9RyPD","Playboi Carti","underground hip hop","related",3,"Playboi Carti is also known as “Cash Carti” and is signed to A$AP Rocky & Awful Records. Carti was Born in Atlanta, Georgia. With bangers like “Broke Boi”“, & “Fetti”, Carti is gearing up to release his first mixtape : Cash Carti. <a href=""https://www.last.fm/music/Playboi+Carti"">Read more on Last.fm</a>",NA,NA,NA,"https://i.scdn.co/image/d6accb84fe147339c69ed9294131f18d1344b270"
"106","7BaOGj1Tm9WcFYVwSNqjrO","The Low Down","dwn trap","related",2," <a href=""https://www.last.fm/music/The+Low+Down"">Read more on Last.fm</a>","0EwcHsy6FsFHxtA5dI7Ull","Just for the Night","https://p.scdn.co/mp3-preview/11c83c8cd50a29c97aa0f3c5c1bab95536fbaceb","https://i.scdn.co/image/0c8b6b08fc19e953c8675fb8cbf602ab7cee0e93"
"107","5lCY3tqdQxbeg5igSlObaT","Nebu Kiniza","dwn trap","related",5," <a href=""https://www.last.fm/music/Nebu+Kiniza"">Read more on Last.fm</a>","6JjEVlMkfHWMeYavkEYzNO","Gassed Up","https://p.scdn.co/mp3-preview/d4bf0839e07f82f7c054de6aba7371fea010dad0","https://i.scdn.co/image/6cab8856795bf9858743220a4fb55f9f0a8814d5"
