"","isbn","title","authors","publishedDate","publisher","categories","pageCount","averageRating","ratingsCount","maturityRating","imageThumbnail","infoLink","textSnippet"
"104","0394800826","The King's Stilts","Dr. Seuss","1939","Random House Books for Young Readers","Juvenile Fiction",48,4,12,"NOT_MATURE","http://books.google.com/books/content?id=wyrhAAAAMAAJ&printsec=frontcover&img=1&zoom=5&source=gbs_api","http://books.google.com/books?id=wyrhAAAAMAAJ&dq=isbn:0394800826&hl=&source=gbs_api","When the King&#39;s stilts are stolen and he can no longer enjoy his play hour, the whole kingdom is threatened with destruction until a page boy bravely saves the day, in this color-enhanced 75th anniversary edition of the Dr. Seuss classic."
"105","0803955405","Qualitative Data Analysis","Matthew B. Miles, A. Michael Huberman","1994-01-12","SAGE","Social Science",338,4,12,"NOT_MATURE","http://books.google.com/books/content?id=U4lU_-wJ5QEC&printsec=frontcover&img=1&zoom=5&edge=curl&source=gbs_api","http://books.google.com/books?id=U4lU_-wJ5QEC&dq=isbn:0803955405&hl=&source=gbs_api","Bringing the art of qualitative analysis up-to-date, this edition adds hundreds of new techniques, ideas and references developed in the past decade."
"106","074322311X","Green Grass Grace","Shawn McBride","2003-03-04","Touchstone","Fiction",304,4,3,"MATURE","http://books.google.com/books/content?id=WAlbAAAAMAAJ&printsec=frontcover&img=1&zoom=5&source=gbs_api","http://books.google.com/books?id=WAlbAAAAMAAJ&dq=isbn:074322311X&hl=&source=gbs_api","Gritty, giddy, and bursting with Henry&#39;s boundless energy, Green Grass Grace is a heart-thumping rocket ride back to adolescence that is riotously funny and tragic at the same time."
"107","0684822776","Riders","Tim Winton","1996-06-23","Simon and Schuster","Fiction",384,2.5,4,"NOT_MATURE","http://books.google.com/books/content?id=100mUwKCqngC&printsec=frontcover&img=1&zoom=5&edge=curl&source=gbs_api","http://books.google.com/books?id=100mUwKCqngC&dq=isbn:0684822776&hl=&source=gbs_api","Fred Scully searches for his pregnant wife, who disappears without an explanation, leaving him with Billy, his seven-year-old daughter"
"108","0553299352","Bring Me the Head of Prince Charming","Roger Zelazny","1992","Spectra","Fiction",310,4.5,2,"NOT_MATURE","http://books.google.com/books/content?id=V0GtFFhDUvIC&printsec=frontcover&img=1&zoom=5&source=gbs_api","http://books.google.com/books?id=V0GtFFhDUvIC&dq=isbn:0553299352&hl=&source=gbs_api","Eager to win the coveted Millennial Evil Deeds Award for reshaping the world, Azzie Elbub, a demon, decides to create a Prince Charming and a Sleeping Beauty who will help his cause. Reprint."
"109","0226323986","Gilgamesh Epic and Old Testament Parallels","Alexander Heidel","1949-01","University of Chicago Press","Religion",269,2.5,2,"NOT_MATURE","http://books.google.com/books/content?id=iRwMQVdZegAC&printsec=frontcover&img=1&zoom=5&edge=curl&source=gbs_api","http://books.google.com/books?id=iRwMQVdZegAC&dq=isbn:0226323986&hl=&source=gbs_api","Cuneiform records made some three thousand years ago are the basis for this essay on the ideas of death and the afterlife and the story of the flood which were current among the ancient peoples of the Tigro-Euphrates Valley."
"110","067187778X","The Free Bards","Lackey","1997-05-01","Baen","Fiction",720,3.5,3,"NOT_MATURE","http://books.google.com/books/content?id=VvkEAAAACAAJ&printsec=frontcover&img=1&zoom=5&source=gbs_api","http://books.google.com/books?id=VvkEAAAACAAJ&dq=isbn:067187778X&hl=&source=gbs_api","Comines the stories of Rune, the greatest violinist who played the Ghost of Skull Hill to sleep; Robin who must recruit the Ghost to aid their cause; and Nightingale who joins forces with T&#39;fyrr, a nonhuman with the face of a raptor"
"111","0811201902","The Wall (Intimacy) and Other Stories","Jean-Paul Sartre","1969-01","New Directions Publishing","Fiction",144,5,1,"NOT_MATURE","http://books.google.com/books/content?id=_ze9oH1afhcC&printsec=frontcover&img=1&zoom=5&edge=curl&source=gbs_api","http://books.google.com/books?id=_ze9oH1afhcC&dq=isbn:0811201902&hl=&source=gbs_api","One of Sartre s greatest existentialist works of fiction, The Wall contains the only five short stories he ever wrote. Set during the Spanish Civil War, the title story crystallizes the famous philosopher s existentialism."
"112","0064450937","Fossils Tell of Long Ago","Aliki","1990-03-21","Collins","Juvenile Nonfiction",32,4.5,4,"NOT_MATURE","http://books.google.com/books/content?id=-o-hGwAACAAJ&printsec=frontcover&img=1&zoom=5&source=gbs_api","http://books.google.com/books?id=-o-hGwAACAAJ&dq=isbn:0064450937&hl=&source=gbs_api","A fossil is anything that has been preserved, one way or another, that tells about life on Earth. But you can make a fossil, too--something to be discovered a million years from now--and this book will tell you how."
"113","0394860152","Man O' War","Walter Farley","1962","Yearling","Juvenile Fiction",339,4,3,"NOT_MATURE","http://books.google.com/books/content?id=qS_JYJ0ho60C&printsec=frontcover&img=1&zoom=5&source=gbs_api","http://books.google.com/books?id=qS_JYJ0ho60C&dq=isbn:0394860152&hl=&source=gbs_api","A fictionalized biography of the American race horse who won twenty of twenty-one races, told by a stable boy who grew up with the great horse."
"114","0345459210","The Flood","","2003","Del Rey","Fiction",341,4.5,4,"NOT_MATURE","http://books.google.com/books/content?id=ujlaXVJ3kXsC&printsec=frontcover&img=1&zoom=5&source=gbs_api","http://books.google.com/books?id=ujlaXVJ3kXsC&dq=isbn:0345459210&hl=&source=gbs_api","Fleeing the destruction of the planet Reach, the Master Chief and a few human survivors crash-land on Halo, where they race to unravel its secrets in order to gain control of a great source of power before the alien occupiers do."
"115","0440237815","Dr. Franklin's Island","Ann Halam","2003","Laurel Leaf","Juvenile Fiction",272,4.5,4,"NOT_MATURE","http://books.google.com/books/content?id=5pQWmLmHSPYC&printsec=frontcover&img=1&zoom=5&source=gbs_api","http://books.google.com/books?id=5pQWmLmHSPYC&dq=isbn:0440237815&hl=&source=gbs_api","When their plane crashes over the Pacific Ocean, three science students are left stranded on a tropical island and then imprisoned by a doctor who is performing horrifying experiments on humans involving the transfer of animal genes."
"116","055329993X","The Return of the Ragpicker","Og Mandino","1993-01-01","Bantam","Religion",160,5,1,"NOT_MATURE","http://books.google.com/books/content?id=PdFIzWnuOcgC&printsec=frontcover&img=1&zoom=5&source=gbs_api","http://books.google.com/books?id=PdFIzWnuOcgC&dq=isbn:055329993X&hl=&source=gbs_api","In the sequel to The Greatest Miracle in the World, the inspirational self-help author offers a set of principles designed to point readers toward a more promising and prosperous future. Reprint."
"117","0312035470","Wuthering Heights","Emily Brontë, Linda H. Peterson","1992","Bedford/st Martins","Fiction",467,3.5,54,"NOT_MATURE","http://books.google.com/books/content?id=TC9qnKXX6n4C&printsec=frontcover&img=1&zoom=5&source=gbs_api","http://books.google.com/books?id=TC9qnKXX6n4C&dq=isbn:0312035470&hl=&source=gbs_api","In the relationship of Cathy and Heathcliff, and in the wild, bleak Yorkshire Moors of its setting, Wuthering Heights creates a world of its own, conceived with a disregard for convention, an instinct for poetry and for the dark depths of ..."
"118","0451526120","The Age of Innocence","Edith Wharton","1996","Penguin","Fiction",313,4,3,"NOT_MATURE","http://books.google.com/books/content?id=hV1qlYSUuR4C&printsec=frontcover&img=1&zoom=5&source=gbs_api","http://books.google.com/books?id=hV1qlYSUuR4C&dq=isbn:0451526120&hl=&source=gbs_api","Widely regarded as one of Edith Wharton&#39;s greatest achievements, The Age of Innocence is not only subtly satirical, but also a sometimes dark and disturbing comedy of manners in its exploration of the &#39;eternal triangle&#39; of love."
"119","067940712X","One True Thing","Anna Quindlen","1994","Random House Incorporated","Fiction",289,4,17,"NOT_MATURE","http://books.google.com/books/content?id=sDxbAAAAMAAJ&printsec=frontcover&img=1&zoom=5&source=gbs_api","http://books.google.com/books?id=sDxbAAAAMAAJ&dq=isbn:067940712X&hl=&source=gbs_api","By the author of Object Lessons. 100,000 first printing. Tour. From the Paperback edition."
"120","060961004X","Eat Cake","Jeanne Ray","2003","Crown Pub","Fiction",258,3.5,14,"NOT_MATURE","http://books.google.com/books/content?id=CTRbAAAAMAAJ&printsec=frontcover&img=1&zoom=5&source=gbs_api","http://books.google.com/books?id=CTRbAAAAMAAJ&dq=isbn:060961004X&hl=&source=gbs_api","Ruth draws on her talent for concocting delectable cakes and desserts when her family begins to disintegrate around her--her husband loses his job, her mother moves in, and her long-estranged father shows up at the door with no place to go."
"121","0688004717","The Ways of My Grandmothers","Beverly Hungry Wolf","1998-10-21","Harper Collins","Social Science",256,5,1,"NOT_MATURE","http://books.google.com/books/content?id=oiVyUVvQsYgC&printsec=frontcover&img=1&zoom=5&edge=curl&source=gbs_api","http://books.google.com/books?id=oiVyUVvQsYgC&dq=isbn:0688004717&hl=&source=gbs_api","A captivating tapestry of personal and tribal history, legends and myths, and the wisdom passed down through generations of women, this extraordinary book is also a priceless record of the traditional skills and ways of an ancient culture ..."
"122","0385423586","Women of Sand and Myrrh","Ḥanān Shaykh","1992","Anchor","Fiction",280,3,1,"NOT_MATURE","http://books.google.com/books/content?id=YBOzAAAAIAAJ&printsec=frontcover&img=1&zoom=5&source=gbs_api","http://books.google.com/books?id=YBOzAAAAIAAJ&dq=isbn:0385423586&hl=&source=gbs_api","In an unnamed Arab country, four women--Suha, who has a management degree; Tamr, who went on a hunger strike to learn to read; Suzanne, who pretends to commit suicide; and Nur, who sneaks out dressed as a man--try to survive in a society ..."
"123","1400031044","My Name Is Asher Lev","Chaim Potok","2003-03-01","Anchor","Fiction",369,4.5,6,"NOT_MATURE","http://books.google.com/books/content?id=1jgbhghk5QUC&printsec=frontcover&img=1&zoom=5&source=gbs_api","http://books.google.com/books?id=1jgbhghk5QUC&dq=isbn:1400031044&hl=&source=gbs_api","The novelist records the anguish and triumphs of a young painter as he emerges into the great world of art and rejects all else."
"124","076790396X","The Pilates Body","Brooke Siler","2000-01","Broadway","Health & Fitness",194,4.5,4,"NOT_MATURE","http://books.google.com/books/content?id=K92BRAvcujYC&printsec=frontcover&img=1&zoom=5&source=gbs_api","http://books.google.com/books?id=K92BRAvcujYC&dq=isbn:076790396X&hl=&source=gbs_api","Provides a program of Pilates exercises with illustrated step-by-step instructions for a complete circuit of mat exercises With step-by-step instructions, Siler guides the reader through the complete circuit of mat exercises, each of which ..."
"125","0609805797","The Seven Principles for Making Marriage Work","John Mordechai Gottman, Nan Silver","1999","Harmony Books","Family & Relationships",271,4.5,26,"NOT_MATURE","http://books.google.com/books/content?id=L5Ur02Uf_a8C&printsec=frontcover&img=1&zoom=5&edge=curl&source=gbs_api","http://books.google.com/books?id=L5Ur02Uf_a8C&dq=isbn:0609805797&hl=&source=gbs_api","Drawing on research into the dynamics of healthy relationships, a study of the basic principles that make up a long-lasting marriage shares advice on how to cope with such issues as work, children, money, sex, and stress."
"126","0393313697","101 Unuseless Japanese Inventions","Kenji Kawakami","1995","W. W. Norton & Company","Humor",159,4,5,"NOT_MATURE","http://books.google.com/books/content?id=3STDhgGiHigC&printsec=frontcover&img=1&zoom=5&edge=curl&source=gbs_api","http://books.google.com/books?id=3STDhgGiHigC&dq=isbn:0393313697&hl=&source=gbs_api","From the land of the rising sun come strangely practical and utterly eccentric inventions for a life of ease--and hilarity."
"127","0394714865","The empire's old clothes","Ariel Dorfman","1983","Pantheon","Juvenile Fiction",225,4,1,"NOT_MATURE","http://books.google.com/books/content?id=MsmEAAAAIAAJ&printsec=frontcover&img=1&zoom=5&source=gbs_api","http://books.google.com/books?id=MsmEAAAAIAAJ&dq=isbn:0394714865&hl=&source=gbs_api","Argues that popular culture, in books, comics, and magazines, reflects reactionary values and looks at examples in the United States and Chile"
"128","0394723694","Flash of the Spirit","Robert Farris Thompson","1984","Vintage","Art",317,4,1,"NOT_MATURE","http://books.google.com/books/content?id=BLLtAAAAMAAJ&printsec=frontcover&img=1&zoom=5&source=gbs_api","http://books.google.com/books?id=BLLtAAAAMAAJ&dq=isbn:0394723694&hl=&source=gbs_api","This landmark book shows how five African civilization have informed and are reflected in the aesthetic, social and metaphysical traditions of black people in the United States, Cuba, Haiti, Trinidad, Mexico, Brazil, and other places in the ..."
"129","0688107559","The Rainbabies","Laura Krauss Melmed","1992","Lothrop Lee & Shepard","Juvenile Fiction",32,4,6,"NOT_MATURE","http://books.google.com/books/content?id=xsQWAQAAMAAJ&printsec=frontcover&img=1&zoom=5&source=gbs_api","http://books.google.com/books?id=xsQWAQAAMAAJ&dq=isbn:0688107559&hl=&source=gbs_api","When the moon gives twelve tiny babies to a childless couple, the new parents take great care of their charges and eventually receive an unexpected reward."
"130","0932194257","Struggle for Intimacy","Janet G. Woititz","1985","HCI","Family & Relationships",101,4,1,"NOT_MATURE","http://books.google.com/books/content?id=D-zMeacBrNwC&printsec=frontcover&img=1&zoom=5&source=gbs_api","http://books.google.com/books?id=D-zMeacBrNwC&dq=isbn:0932194257&hl=&source=gbs_api","Offers advice for the children of alcoholics on how to cope with their emotional problems and develop an intimate family relationship"
"131","189094808X","Clicking with Your Dog","Peggy Tillman","2001","Sunshine Books (MA)","Pets",209,4.5,3,"NOT_MATURE","http://books.google.com/books/content?id=teH1AAAACAAJ&printsec=frontcover&img=1&zoom=5&source=gbs_api","http://books.google.com/books?id=teH1AAAACAAJ&dq=isbn:189094808X&hl=&source=gbs_api","&quot; ... A new method of animal training using positive reinforcement and a &#39;clicker&#39; is easy for you and fun for your dog.&quot;--Cover."
"132","0553480553","The Middle School Gets Married","Jamie Suzanne, Francine Pascal","1993","Sweet Valley","Juvenile Fiction",135,3.5,2,"NOT_MATURE","http://books.google.com/books/content?id=hfBoUF3IYGMC&printsec=frontcover&img=1&zoom=5&source=gbs_api","http://books.google.com/books?id=hfBoUF3IYGMC&dq=isbn:0553480553&hl=&source=gbs_api","Paired up into pretend couples for a school-wide project on family living, the students of the Sweet Valley Middle School soon get a taste of the difficulties of married life. Original."
"133","0895776944","How Things Work","Neil Ardley","1995","Readers Digest","Science",192,4,1,"NOT_MATURE","http://books.google.com/books/content?id=58gNAAAACAAJ&printsec=frontcover&img=1&zoom=5&source=gbs_api","http://books.google.com/books?id=58gNAAAACAAJ&dq=isbn:0895776944&hl=&source=gbs_api","Identifies the scientific principles behind a variety of everyday objects while providing a range of informative and easy-to perform experiments, and highlights such items as a battery, a bar-code reader, and a disk drive. 40,000 first ..."
"134","0020418604","Albert Einstein","Marie Hammontree","1986-10-31","Simon and Schuster","Juvenile Fiction",192,5,1,"NOT_MATURE","http://books.google.com/books/content?id=tr7qTAGjuqIC&printsec=frontcover&img=1&zoom=5&edge=curl&source=gbs_api","http://books.google.com/books?id=tr7qTAGjuqIC&dq=isbn:0020418604&hl=&source=gbs_api","Presents the early life of the German-born physicist whose theory of relativity revolutionized scientific thinking."
"135","0394839161","The Black Stallion's Filly","Walter Farley","1978-06-12","Yearling","Juvenile Fiction",288,5,2,"NOT_MATURE","http://books.google.com/books/content?id=KTUBwb3glGcC&printsec=frontcover&img=1&zoom=5&source=gbs_api","http://books.google.com/books?id=KTUBwb3glGcC&dq=isbn:0394839161&hl=&source=gbs_api","When Henry Dailey buys Black Minx he is the only trainer who sees her as a potential contender in the Kentucky Derby."
"136","0395522072","Zella, Zack and Zodiac","Bill Peet","1989-10","Houghton Mifflin Harcourt","Juvenile Fiction",32,4,1,"NOT_MATURE","http://books.google.com/books/content?id=8uZmdKOw5FkC&printsec=frontcover&img=1&zoom=5&edge=curl&source=gbs_api","http://books.google.com/books?id=8uZmdKOw5FkC&dq=isbn:0395522072&hl=&source=gbs_api","A zebra named Zella adopts and cares for a baby ostrich, who has hatched all alone. When Zella gives birth to a rather awkward baby, the now-grown ostrich saves the zebra colt from a lion and protects him until he is on his own."
"137","0440402565","Touch the Moon","Marion Dane Bauer","1989-12-01","Yearling Books","Juvenile Fiction",96,4,1,"NOT_MATURE","http://books.google.com/books/content?id=_azw6WbmY30C&printsec=frontcover&img=1&zoom=5&source=gbs_api","http://books.google.com/books?id=_azw6WbmY30C&dq=isbn:0440402565&hl=&source=gbs_api","When the china horse Jennifer receives for her birthday is magically transformed into a real horse, they share an evening of fantastic adventures."
"138","0689803931","Misty's Twilight","Marguerite Henry","1996","Simon and Schuster","Juvenile Fiction",142,2.5,2,"NOT_MATURE","http://books.google.com/books/content?id=MRmvhJrlOSwC&printsec=frontcover&img=1&zoom=5&edge=curl&source=gbs_api","http://books.google.com/books?id=MRmvhJrlOSwC&dq=isbn:0689803931&hl=&source=gbs_api","Captivated by the story of &quot;Misty of Chincoteague,&quot; a woman with a horse farm in Florida raises one of Misty&#39;s descendants to become a champion show horse."
"139","0452284341","The Food Taster","Peter Elbling","2003","Plume Books","Fiction",272,4,1,"NOT_MATURE","http://books.google.com/books/content?id=DCb2zIQlsbMC&printsec=frontcover&img=1&zoom=5&source=gbs_api","http://books.google.com/books?id=DCb2zIQlsbMC&dq=isbn:0452284341&hl=&source=gbs_api","A bestseller in ten countries, this novel of gastronomical delight and brilliant wit captures the sights, sounds, and tastes of 16th-century ltaly."
"140","0931580587","Ain't Nobody's Business If You Do","Peter McWilliams","1996","Mary Book / Prelude Press","Crimes without victims",692,4.5,5,"NOT_MATURE","http://books.google.com/books/content?id=nsQvU_nxIX4C&printsec=frontcover&img=1&zoom=5&source=gbs_api","http://books.google.com/books?id=nsQvU_nxIX4C&dq=isbn:0931580587&hl=&source=gbs_api","Argues that criminalization of certain activities has a negative effect on society, denies constitutional rights, and misunderstands religious teachings"
"141","0684849577","The War Against Boys","Christina Hoff Sommers","2001-06-12","Simon and Schuster","Psychology",256,3.5,4,"NOT_MATURE","http://books.google.com/books/content?id=cnieFlrhxgoC&printsec=frontcover&img=1&zoom=5&edge=curl&source=gbs_api","http://books.google.com/books?id=cnieFlrhxgoC&dq=isbn:0684849577&hl=&source=gbs_api","Argues that boys have become the primary victims of American society, showing how boys&#39; weaknesses are aggravated by anti-boy prejudices and offering constructive suggestions on how to help young males."
"142","0060096624","The Worm in the Apple","Peter Brimelow","2004-01-20","Harper Collins","Education",320,5,1,"NOT_MATURE","http://books.google.com/books/content?id=ZDLTuAA2240C&printsec=frontcover&img=1&zoom=5&edge=curl&source=gbs_api","http://books.google.com/books?id=ZDLTuAA2240C&dq=isbn:0060096624&hl=&source=gbs_api","In this devastating critique, Peter Brimelow exposes the teacher unions for what they are: a political and economic monopoly that is choking the education system. It is time, Brimelow convincingly argues, to bust the Teacher Trust."
"143","0226264211","Capitalism and Freedom","Milton Friedman, Rose D. Friedman","2002-11-15","University of Chicago Press","Business & Economics",208,4,6,"NOT_MATURE","http://books.google.com/books/content?id=iCRk066ybDAC&printsec=frontcover&img=1&zoom=5&edge=curl&source=gbs_api","http://books.google.com/books?id=iCRk066ybDAC&dq=isbn:0226264211&hl=&source=gbs_api","In this classic book, Milton Friedman provides the definitive statement of his immensely influential economic philosophy—one in which competitive capitalism serves as both a device for achieving economic freedom and a necessary condition ..."
"144","0226493644","More Guns, Less Crime","John R Lott","2000-06-15","University of Chicago Press","Social Science",332,4,1,"NOT_MATURE","http://books.google.com/books/content?id=10KKjwEACAAJ&printsec=frontcover&img=1&zoom=5&source=gbs_api","http://books.google.com/books?id=10KKjwEACAAJ&dq=isbn:0226493644&hl=&source=gbs_api","In this paperback edition, Lott has expanded the research through 1996, incorporating new data available from states that passed right-to-carry and other gun laws since the book&#39;s publication as well as new city-level statistics."
"145","0671633813","Encyclopedia of Modern Bodybuilding","Arnold Schwarzenegger, Bill Dobbins","1987","Fireside","Sports & Recreation",736,5,2,"NOT_MATURE","http://books.google.com/books/content?id=d5AJAAAACAAJ&printsec=frontcover&img=1&zoom=5&source=gbs_api","http://books.google.com/books?id=d5AJAAAACAAJ&dq=isbn:0671633813&hl=&source=gbs_api","The seven-time Mr. Olympia winner offers information on training, posing, diet, nutrition, and body-part exercises, plus basic, advanced and competitive training programs designed for bodybuilders of all levels"
"146","0895261146","The Bias Against Guns","John R. Lott Jr.","2003-02-01","Regnery Publishing","Political Science",256,4.5,3,"NOT_MATURE","http://books.google.com/books/content?id=HYOiZg1bYEIC&printsec=frontcover&img=1&zoom=5&source=gbs_api","http://books.google.com/books?id=HYOiZg1bYEIC&dq=isbn:0895261146&hl=&source=gbs_api","&quot;If you want the truth the anti-gunners don&#39;t want you to know...you need a copy of The Bias Against Guns&quot; --Sean Hannity of Fox News Channel&#39;s Hannity &amp; Colmes"
"147","0945466226","Education: Free and Compulsory","","1979","Ludwig von Mises Institute","Education, Compulsory",51,4.5,2,"NOT_MATURE","http://books.google.com/books/content?id=vrZSPId9H8YC&printsec=frontcover&img=1&zoom=5&edge=curl&source=gbs_api","https://play.google.com/store/books/details?id=vrZSPId9H8YC&source=gbs_api","An interesting feature of this book is its promotion of individual, or home, schooling, long before the current popularity of the practice."
"148","1886969353","Shao Lin Pai Ho","Jwing-Ming Yang","1996-01-01","Ymaa Publications","Sports & Recreation",337,4,1,"NOT_MATURE","http://books.google.com/books/content?id=RCcBAAAACAAJ&printsec=frontcover&img=1&zoom=5&source=gbs_api","http://books.google.com/books?id=RCcBAAAACAAJ&dq=isbn:1886969353&hl=&source=gbs_api","Reveals the secrets of Chinese internal power development."
"149","0142437433","The Psychopathology of Everyday Life","Sigmund Freud","2003","Penguin","Psychology",264,3.5,5,"NOT_MATURE","http://books.google.com/books/content?id=cNE7Ag2q0tgC&printsec=frontcover&img=1&zoom=5&edge=curl&source=gbs_api","http://books.google.com/books?id=cNE7Ag2q0tgC&dq=isbn:0142437433&hl=&source=gbs_api","Starting with the story of how he once forgot the name of an Italian painter-and how a young acquaintance mangled a quotation from Virgil through fears that his girlfriend might be pregnant-it brings together a treasure trove of muddled ..."
"150","0810918889","Ali Baba and the Forty Thieves","","1989-03-25","Harry N Abrams Incorporated","Social Science",32,3.5,4,"NOT_MATURE","http://books.google.com/books/content?id=jGPhAAAAMAAJ&printsec=frontcover&img=1&zoom=5&source=gbs_api","http://books.google.com/books?id=jGPhAAAAMAAJ&dq=isbn:0810918889&hl=&source=gbs_api","The famous story is illustrated in the style of tenth-century Persian miniatures."
"151","0380973871","The October Country","Ray Bradbury","1999-09-07","Harper Collins","Fiction",352,3,1,"NOT_MATURE","http://books.google.com/books/content?id=6zk3f4_78I4C&printsec=frontcover&img=1&zoom=5&edge=curl&source=gbs_api","http://books.google.com/books?id=6zk3f4_78I4C&dq=isbn:0380973871&hl=&source=gbs_api","Welcome to a land Ray Bradbury calls &quot;the Undiscovered Country&quot; of his imagination--that vast territory of ideas, concepts, notions and conceits where the stories you now hold were born."
"152","0452264863","Night of January 16th","Ayn Rand","1987","Penguin","Drama",122,3.5,3,"NOT_MATURE","http://books.google.com/books/content?id=5r6wAAAAIAAJ&printsec=frontcover&img=1&zoom=5&source=gbs_api","http://books.google.com/books?id=5r6wAAAAIAAJ&dq=isbn:0452264863&hl=&source=gbs_api","Night of January 16th leaves the answers to the mystery of an international magnate&#39;s death up to the reader."
"153","0452282314","The Art of Nonfiction","Ayn Rand, Robert Mayhew","2001","Penguin","Language Arts & Disciplines",192,5,2,"NOT_MATURE","http://books.google.com/books/content?id=iXRiAAAAMAAJ&printsec=frontcover&img=1&zoom=5&source=gbs_api","http://books.google.com/books?id=iXRiAAAAMAAJ&dq=isbn:0452282314&hl=&source=gbs_api","Offers a step-by-step study of the nonfiction writing process, discussing the psychological facets of writing, the roles of the subconcious and conscious minds, and developing a personal writing style."
