"","isbn","title","authors","publishedDate","publisher","categories","pageCount","averageRating","ratingsCount","maturityRating","imageThumbnail","infoLink","textSnippet"
"154","0679745351","Among the Thugs","Bill Buford","1991","Vintage","History",317,5,6,"NOT_MATURE","http://books.google.com/books/content?id=40wXcw9fzPwC&printsec=frontcover&img=1&zoom=5&source=gbs_api","http://books.google.com/books?id=40wXcw9fzPwC&dq=isbn:0679745351&hl=&source=gbs_api","A journalist who spent eight years traveling with and gathering information on Britain&#39;s notorious soccer hooligans chronicles his extraordinary experiences with these dangerous, violent, and fiercely loyal fans."
"155","0451625676","Malory's Le Morte D'Arthur","Sir Thomas Malory, Keith Baines, Robert Graves","1962","Signet","Arthurian romances",512,4,2,"NOT_MATURE","http://books.google.com/books/content?id=iWHuQwAACAAJ&printsec=frontcover&img=1&zoom=5&source=gbs_api","http://books.google.com/books?id=iWHuQwAACAAJ&dq=isbn:0451625676&hl=&source=gbs_api","Malory&#39;s Le Morte d&#39;Arthur endures and inspires because it embodies mankind&#39;s deepest yearnings for brotherhood and community, a love worth dying for, and valor, honor, and chivalry. &quot;From the Trade Paperback edition.&quot;"
"156","0385318731","Fight the Power","Chuck D","1998","Delta","Music",274,4,3,"NOT_MATURE","http://books.google.com/books/content?id=ehE5AQAAIAAJ&printsec=frontcover&img=1&zoom=5&source=gbs_api","http://books.google.com/books?id=ehE5AQAAIAAJ&dq=isbn:0385318731&hl=&source=gbs_api","The leader of the rap group Public Enemy offers his views on self-empowerment in the African-American community, the effect of rap lyrics on youth, and Hollywood&#39;s images of blacks. the first substantial book by a rapper, offers readers a ..."
"157","0140186476","Dubliners","James Joyce","1914","Penguin","Fiction",316,4,86,"NOT_MATURE","http://books.google.com/books/content?id=Qoi2aHzcGq8C&printsec=frontcover&img=1&zoom=5&edge=curl&source=gbs_api","http://books.google.com/books?id=Qoi2aHzcGq8C&dq=isbn:0140186476&hl=&source=gbs_api","Fifteen stories evoke the character, atmosphere, and people of Dublin at the turn of the century."
"158","0670886696","Mao Zedong","Jonathan D. Spence","1999","Viking Press","Biography & Autobiography",188,3,1,"NOT_MATURE","http://books.google.com/books/content?id=1eYAng5JIkEC&printsec=frontcover&img=1&zoom=5&source=gbs_api","http://books.google.com/books?id=1eYAng5JIkEC&dq=isbn:0670886696&hl=&source=gbs_api","This intimate portrait of Mao Zedong, one of the most formidable and elusive rulers in modern history, introduces the essential background about the Chinese leader, including his relations with family, friends, and confidential assistants, ..."
"159","1853268968","Sherlock Holmes","Arthur Conan Doyle","1989","Wordsworth Editions","Fiction",1408,4.5,6,"NOT_MATURE","http://books.google.com/books/content?id=Fq1uKmT02aMC&printsec=frontcover&img=1&zoom=5&edge=curl&source=gbs_api","http://books.google.com/books?id=Fq1uKmT02aMC&dq=isbn:1853268968&hl=&source=gbs_api","The stories are illustrated by the remarkable Sydney Paget from whom our images of Sherlock Holmes and his world derive and who first equipped Holmes with his famous deerstalker hat."
"160","067175145X","The way things ought to be","Rush H. Limbaugh","1992-10","Atria Books","Biography & Autobiography",304,2.5,19,"NOT_MATURE","http://books.google.com/books/content?id=b8fItyXTZ28C&printsec=frontcover&img=1&zoom=5&source=gbs_api","http://books.google.com/books?id=b8fItyXTZ28C&dq=isbn:067175145X&hl=&source=gbs_api","Limbaugh delivers his spirited defense of conservative values in blunt talk, with scathing wit."
"161","0451526503","Adventures of Huckleberry Finn","Mark Twain","1997","Penguin","Fiction",283,5,1,"NOT_MATURE","http://books.google.com/books/content?id=J4S0jvSCjDYC&printsec=frontcover&img=1&zoom=5&source=gbs_api","http://books.google.com/books?id=J4S0jvSCjDYC&dq=isbn:0451526503&hl=&source=gbs_api","Rich in color, humor, and the adventurous frontier experience of the Mississippi, this great novel vividly recreates the world, the people, and the language that Mark Twain knew and loved from his own years on the riverboats."
"162","0061065714","Two of a Kind #01: It's a Twin Thing","Mary-Kate & Ashley Olsen","1999-01-06","Harper Collins","Juvenile Fiction",112,1,1,"NOT_MATURE","http://books.google.com/books/content?id=qBuMlS7xMlEC&printsec=frontcover&img=1&zoom=5&source=gbs_api","http://books.google.com/books?id=qBuMlS7xMlEC&dq=isbn:0061065714&hl=&source=gbs_api","Mary-Kate and Ashley think they are too old to have a babysitter."
"163","0061094161","365 Ways to Cook Pasta","Marie Simmons","1995-01-26","HarperCollins Publishers","Cooking",240,4,1,"NOT_MATURE","http://books.google.com/books/content?id=CrAxzL7LXy8C&printsec=frontcover&img=1&zoom=5&source=gbs_api","http://books.google.com/books?id=CrAxzL7LXy8C&dq=isbn:0061094161&hl=&source=gbs_api","For emergency dinners as well as dinner parties, whether you&#39;re in the mood for something light or a hearty dish to stick to your ribs, from the traditional to the exotic, this book provides recipes for new and exciting pasta dishes every ..."
"164","0395390303","Curious George Visits the Zoo","Margret Rey, H. A. Rey","1985","Houghton Mifflin Harcourt","Juvenile Fiction",32,3.5,9,"NOT_MATURE","http://books.google.com/books/content?id=bupQxWF7BgIC&printsec=frontcover&img=1&zoom=5&edge=curl&source=gbs_api","http://books.google.com/books?id=bupQxWF7BgIC&dq=isbn:0395390303&hl=&source=gbs_api","Curious George visits the zoo and manages to both cause trouble and make up for it in his inimitable fashion."
"165","0689716958","Zeely","Virginia Hamilton","1993-04-30","Aladdin","Juvenile Fiction",128,5,1,"NOT_MATURE","http://books.google.com/books/content?id=-fhqQXlwr8EC&printsec=frontcover&img=1&zoom=5&source=gbs_api","http://books.google.com/books?id=-fhqQXlwr8EC&dq=isbn:0689716958&hl=&source=gbs_api","When Geeder finally meets Zeely, she gains a new perspective on daydreams and reality and a more realistic appreciation of Zeely&#39;s true character&quot;.--Booklist. Illustrated."
"166","0399504338","Amphigorey","","1980-01-01","Penguin","Comics & Graphic Novels",220,4,20,"NOT_MATURE","http://books.google.com/books/content?id=uQe2a18Ly6wC&printsec=frontcover&img=1&zoom=5&edge=curl&source=gbs_api","http://books.google.com/books?id=uQe2a18Ly6wC&dq=isbn:0399504338&hl=&source=gbs_api","Fifteen works by the American artist and author provide a journey into a macabre world"
"167","0553379658","My Ishmael","Daniel Quinn","1998","Bantam","Fiction",288,4,55,"NOT_MATURE","http://books.google.com/books/content?id=OYoBS1mWVr4C&printsec=frontcover&img=1&zoom=5&source=gbs_api","http://books.google.com/books?id=OYoBS1mWVr4C&dq=isbn:0553379658&hl=&source=gbs_api","Traces the relationship between a lowland gorilla with telepathic powers and a humanitarian twelve-year-old girl, who challenges his role and his wisdom as a teacher of humanity"
"168","1565122259","Educating Esmé","Esmé Raji Codell","1999","Algonquin Books","Education",204,5,1,"NOT_MATURE","http://books.google.com/books/content?id=oQ0mAQAAIAAJ&printsec=frontcover&img=1&zoom=5&source=gbs_api","http://books.google.com/books?id=oQ0mAQAAIAAJ&dq=isbn:1565122259&hl=&source=gbs_api","There is nothing the profession needs more than such creative intelligent, combative, and loving teachers.&quot; ( Herbert Kohl, author of &quot;36 Children&quot;) Esme Raji Codell has come to teach."
"169","006097625X","Understanding Comics","Scott McCloud, Scott McCloud","1994-04-27","Harper Collins","Comics & Graphic Novels, Art",224,4,1922,"NOT_MATURE","http://books.google.com/books/content?id=tUwqbo48lp4C&printsec=frontcover&img=1&zoom=5&edge=curl&source=gbs_api","http://books.google.com/books?id=tUwqbo48lp4C&dq=isbn:006097625X&hl=&source=gbs_api","Praised throughout the cartoon industry by such luminaries as Art Spiegelman, Matt Groening, and Will Eisner, this innovative comic book provides a detailed look at the history, meaning, and art of comics and cartooning."
"170","006097625X","Understanding Comics","Scott McCloud, Scott McCloud","1993","William Morrow Paperbacks","Comics & Graphic Novels, Art",215,4,1919,"NOT_MATURE","http://books.google.com/books/content?id=Z1s_AQAAIAAJ&printsec=frontcover&img=1&zoom=5&source=gbs_api","http://books.google.com/books?id=Z1s_AQAAIAAJ&dq=isbn:006097625X&hl=&source=gbs_api","Traces the 3,000 year history of storytelling through pictures, discussing the language and images used."
"171","0395870828","Tuesday","David Wiesner","1991","Houghton Mifflin Harcourt","Juvenile Fiction",32,4,106,"NOT_MATURE","http://books.google.com/books/content?id=gGWvDUUi58cC&printsec=frontcover&img=1&zoom=5&edge=curl&source=gbs_api","http://books.google.com/books?id=gGWvDUUi58cC&dq=isbn:0395870828&hl=&source=gbs_api","Frogs rise on their lily pads, float through the air, and explore the nearby houses while their inhabitants sleep."
"172","0440406943","Ingri and Edgar Parin D'Aulaire's Book of Greek Myths","Ingri D'Aulaire, Edgar Parin D'Aulaire","1992","Delacorte Press","Juvenile Fiction",192,4.5,23,"NOT_MATURE","http://books.google.com/books/content?id=gvWKTD0YTbMC&printsec=frontcover&img=1&zoom=5&edge=curl&source=gbs_api","http://books.google.com/books?id=gvWKTD0YTbMC&dq=isbn:0440406943&hl=&source=gbs_api","An introduction to the gods and goddesses of ancient Greece."
"173","0618007016","The Three Pigs","David Wiesner, David Wiesner","2001","Houghton Mifflin Harcourt","Juvenile Fiction, Juvenile Fiction",40,4.5,4,"NOT_MATURE","http://books.google.com/books/content?id=mmVFI3WUOgMC&printsec=frontcover&img=1&zoom=5&edge=curl&source=gbs_api","http://books.google.com/books?id=mmVFI3WUOgMC&dq=isbn:0618007016&hl=&source=gbs_api","The three pigs escape the wolf by going into another world where they meet the cat and the fiddle, the cow that jumped over the moon, and a dragon. By the creator of the Caldecott Honor book, Sector 7."
"174","0618007016","The Three Pigs","David Wiesner, David Wiesner","2001","Houghton Mifflin Harcourt","Juvenile Fiction, Juvenile Fiction",40,5,1,"NOT_MATURE","http://books.google.com/books/content?id=MxBZLWDEe4UC&printsec=frontcover&img=1&zoom=5&source=gbs_api","http://books.google.com/books?id=MxBZLWDEe4UC&dq=isbn:0618007016&hl=&source=gbs_api","The three pigs escape the wolf by going into another world where they meet the cat and the fiddle, the cow that jumped over the moon, and a dragon. By the creator of the Caldecott Honor book, Sector 7."
"175","0735712069","The Unusually Useful Web Book","June Cohen","2003","New Riders","Computers",388,4,5,"NOT_MATURE","http://books.google.com/books/content?id=extn_UeicFoC&printsec=frontcover&img=1&zoom=5&edge=curl&source=gbs_api","http://books.google.com/books?id=extn_UeicFoC&dq=isbn:0735712069&hl=&source=gbs_api","• •Discover unusually useful website tips and tricks for increasing traffic, visitor frequency, and search engine rankings, and selecting traffic analysis software. •Written by the former VP of Content Development for HotWired, the ..."
"176","0930289544","Swamp thing","Alan Moore","1990-01-01","Vertigo","Comics & Graphic Novels",205,4,2,"NOT_MATURE","http://books.google.com/books/content?id=AX0qAAAAYAAJ&printsec=frontcover&img=1&zoom=5&source=gbs_api","http://books.google.com/books?id=AX0qAAAAYAAJ&dq=isbn:0930289544&hl=&source=gbs_api","Swamp Thing . . . the only one who can save mankind."
"177","094679006X","Alan Moore","Smoky Man, Gary Millidge","2003","Abiogenesis Press","Biography & Autobiography",352,3,3,"NOT_MATURE","http://books.google.com/books/content?id=XCwcUOnFV4UC&printsec=frontcover&img=1&zoom=5&edge=curl&source=gbs_api","http://books.google.com/books?id=XCwcUOnFV4UC&dq=isbn:094679006X&hl=&source=gbs_api","The book jacket will feature a new photgraph by Piet Corr and other features will include interviews, biographies, and new and rare photographs."
"178","1563896451","100 Bullets: First shot, last call","Brian Azzarello","2000","Vertigo","Comics & Graphic Novels",125,5,2,"NOT_MATURE","http://books.google.com/books/content?id=BJHodyrdFQAC&printsec=frontcover&img=1&zoom=5&source=gbs_api","http://books.google.com/books?id=BJHodyrdFQAC&dq=isbn:1563896451&hl=&source=gbs_api","What would you do if you were given the opportunity and the means to get away with murder, scot-free?"
"179","0553108743","Everything and a Kite","Ray Romano","1998","Bantam","Humor",209,4,1,"NOT_MATURE","http://books.google.com/books/content?id=EX1ExAaUARAC&printsec=frontcover&img=1&zoom=5&source=gbs_api","http://books.google.com/books?id=EX1ExAaUARAC&dq=isbn:0553108743&hl=&source=gbs_api","The author presents a book of wry observations on suburban family life, as seen by a slightly neurotic Italian-American father of four"
"180","0345430735","Expedition to Earth","Arthur C. Clarke","1998-01","Del Rey","Fiction",178,4,5,"NOT_MATURE","http://books.google.com/books/content?id=KLdBPgAACAAJ&printsec=frontcover&img=1&zoom=5&source=gbs_api","http://books.google.com/books?id=KLdBPgAACAAJ&dq=isbn:0345430735&hl=&source=gbs_api","We were sure we could maintain this superiority. Our belief proved, alas, to be only too well founded . . .&quot; EXPEDITION TO EARTH &quot;It was in the last days of the Empire."
"181","0312749511","The Space Merchants","Frederik Pohl, C. M. Kornbluth","1985","Macmillan","Fiction",176,3.5,20,"NOT_MATURE","http://books.google.com/books/content?id=A_bmszGTbvsC&printsec=frontcover&img=1&zoom=5&edge=curl&source=gbs_api","http://books.google.com/books?id=A_bmszGTbvsC&dq=isbn:0312749511&hl=&source=gbs_api","Mitchell Courtenay, an advertising copywriter of the future is assigned to sway public support for the American colonization of Venus"
